{"actions_version":"actions.v2","lessons":[{"market_ids":["demo-trump-2016"],"text":"I overweighted the late poll bump in three of four politics markets."}],"markets":[{"kind":"target","market_id":"demo-brexit-2016","price_bp":null,"prob_ppm":340000,"side":null,"size":null,"target_position":-40,"ttl_bars":null},{"kind":"limit","market_id":"demo-trump-2016","price_bp":2500,"prob_ppm":300000,"side":"buy","size":20,"target_position":null,"ttl_bars":3},{"kind":"abstain","market_id":"demo-fed-hike-mar-2022","price_bp":null,"prob_ppm":900000,"side":null,"size":null,"target_position":null,"ttl_bars":null}],"notes":"Remain still favoured by the price; polls tightening.","rationale":null,"research":{"kind":"wiki_asof","market_id":"demo-brexit-2016"}}
